{
  "schemaVersion": "1.0.0",
  "id": "agri-special-fund",
  "meta": {
    "title": "農業特別收入基金 細項預算查填",
    "subtitle": "業務計畫／員額用人費／其他管制項目",
    "year": "116",
    "org": "農業部",
    "formCodes": [
      "1-2",
      "1-3",
      "1-4"
    ],
    "units": {
      "amount": "新臺幣千元",
      "headcount": "人"
    },
    "source": {
      "officialFile": "official/FNGBRB5300_20260520173956.xlsx",
      "profile": "profiles/FNGBRB5300.json",
      "note": "金額預設值取自官方彙總檔（元→千元，÷1000）；員額／用人費用／管制項目另需 FNGBRB5320 詳細表。"
    }
  },
  "levelLabels": {
    "0": "甲/乙",
    "1": "一、二、",
    "2": "計畫名 / (一)",
    "3": "1./2.",
    "4": "(1)/(2)"
  },
  "columns": {
    "dec112": {
      "label": "113年度決算",
      "type": "number",
      "tdClass": "sf-num"
    },
    "dec113": {
      "label": "114年度決算",
      "type": "number",
      "tdClass": "sf-num"
    },
    "bud114": {
      "label": "115年度預算",
      "type": "number",
      "tdClass": "sf-num"
    },
    "apr114": {
      "label": "115年4月底在職",
      "type": "number",
      "tdClass": "sf-num"
    },
    "level": {
      "label": "層級",
      "type": "level",
      "tdClass": "sf-lv"
    },
    "name": {
      "label": "項目/科目名稱",
      "type": "text",
      "tdClass": "sf-name"
    },
    "desc": {
      "label": "摘要/說明",
      "type": "textarea",
      "tdClass": "sf-desc"
    },
    "orig": {
      "label": "原編數",
      "type": "number",
      "tdClass": "sf-num"
    },
    "dep_diff": {
      "label": "主管增減(-)",
      "type": "number",
      "tdClass": "sf-num"
    },
    "dep_app": {
      "label": "主管核列",
      "type": "number",
      "tdClass": "sf-num",
      "auto": "dep_app"
    },
    "gov_diff": {
      "label": "院擬增減(-)",
      "type": "number",
      "tdClass": "sf-num"
    },
    "gov_app": {
      "label": "院擬核列",
      "type": "number",
      "tdClass": "sf-num",
      "auto": "gov_app"
    }
  },
  "funds": [
    {
      "id": "plan_agri",
      "code": "agri",
      "name": "農業發展基金",
      "short": "農發",
      "rank": 1
    },
    {
      "id": "plan_forest",
      "code": "forest",
      "name": "林務發展及造林基金",
      "short": "林務",
      "rank": 2
    },
    {
      "id": "plan_disaster",
      "code": "disaster",
      "name": "農業天然災害救助基金",
      "short": "天災",
      "rank": 3
    },
    {
      "id": "plan_fish",
      "code": "fish",
      "name": "漁業發展基金",
      "short": "漁業",
      "rank": 4
    },
    {
      "id": "plan_loss",
      "code": "loss",
      "name": "農產品受進口損害救助基金",
      "short": "農損",
      "rank": 5
    },
    {
      "id": "plan_renewal",
      "code": "renewal",
      "name": "農村再生基金",
      "short": "農再",
      "rank": 6
    }
  ],
  "sections": [
    {
      "suffix": "src",
      "label": "甲、基金來源"
    },
    {
      "suffix": "use",
      "label": "乙、基金用途"
    }
  ],
  "tabs": [
    {
      "id": "plan",
      "suffix": "業務計畫",
      "reviewKey": "plan"
    },
    {
      "id": "personnel",
      "suffix": "員額用人費",
      "reviewKey": "personnel"
    },
    {
      "id": "control",
      "suffix": "管制項目",
      "reviewKey": "control"
    }
  ],
  "rules": {
    "recalcRow": {
      "dep_app": [
        "orig",
        "dep_diff"
      ],
      "gov_app": [
        "dep_app",
        "gov_diff"
      ]
    },
    "planSumFields": [
      "dec113",
      "bud114",
      "orig",
      "dep_diff",
      "gov_diff"
    ],
    "planSumRule": "parent = sum(immediate children)；子列皆無值時保留母列原值並開放編輯",
    "noAutoSumKeywords": [
      "收購糧食",
      "糧食銷售"
    ]
  },
  "data": {
    "agri": "data/sample_fund_agri.json",
    "forest": "data/sample_fund_forest.json",
    "disaster": "data/sample_fund_disaster.json",
    "fish": "data/sample_fund_fish.json",
    "loss": "data/sample_fund_loss.json",
    "renewal": "data/sample_fund_renewal.json"
  },
  "tables": [
    {
      "id": "plan_agri_src",
      "title": "農業發展基金 116年度 主要業務計畫預算表 — 甲、基金來源",
      "sheetId": "1-2",
      "unit": "新臺幣千元",
      "cols": [
        "level",
        "dec113",
        "bud114",
        "name",
        "desc",
        "orig",
        "dep_diff",
        "dep_app",
        "gov_diff",
        "gov_app"
      ],
      "hasLevel": true,
      "reviewKey": "plan",
      "isPlan": true,
      "fundId": "plan_agri",
      "fundCode": "agri",
      "fundName": "農業發展基金",
      "fundShort": "農發",
      "section": "src",
      "sectionLabel": "甲、基金來源",
      "rank": 1
    },
    {
      "id": "plan_agri_use",
      "title": "農業發展基金 116年度 主要業務計畫預算表 — 乙、基金用途",
      "sheetId": "1-2",
      "unit": "新臺幣千元",
      "cols": [
        "level",
        "dec113",
        "bud114",
        "name",
        "desc",
        "orig",
        "dep_diff",
        "dep_app",
        "gov_diff",
        "gov_app"
      ],
      "hasLevel": true,
      "reviewKey": "plan",
      "isPlan": true,
      "fundId": "plan_agri",
      "fundCode": "agri",
      "fundName": "農業發展基金",
      "fundShort": "農發",
      "section": "use",
      "sectionLabel": "乙、基金用途",
      "rank": 1
    },
    {
      "id": "plan_forest_src",
      "title": "林務發展及造林基金 116年度 主要業務計畫預算表 — 甲、基金來源",
      "sheetId": "1-2",
      "unit": "新臺幣千元",
      "cols": [
        "level",
        "dec113",
        "bud114",
        "name",
        "desc",
        "orig",
        "dep_diff",
        "dep_app",
        "gov_diff",
        "gov_app"
      ],
      "hasLevel": true,
      "reviewKey": "plan",
      "isPlan": true,
      "fundId": "plan_forest",
      "fundCode": "forest",
      "fundName": "林務發展及造林基金",
      "fundShort": "林務",
      "section": "src",
      "sectionLabel": "甲、基金來源",
      "rank": 2
    },
    {
      "id": "plan_forest_use",
      "title": "林務發展及造林基金 116年度 主要業務計畫預算表 — 乙、基金用途",
      "sheetId": "1-2",
      "unit": "新臺幣千元",
      "cols": [
        "level",
        "dec113",
        "bud114",
        "name",
        "desc",
        "orig",
        "dep_diff",
        "dep_app",
        "gov_diff",
        "gov_app"
      ],
      "hasLevel": true,
      "reviewKey": "plan",
      "isPlan": true,
      "fundId": "plan_forest",
      "fundCode": "forest",
      "fundName": "林務發展及造林基金",
      "fundShort": "林務",
      "section": "use",
      "sectionLabel": "乙、基金用途",
      "rank": 2
    },
    {
      "id": "plan_disaster_src",
      "title": "農業天然災害救助基金 116年度 主要業務計畫預算表 — 甲、基金來源",
      "sheetId": "1-2",
      "unit": "新臺幣千元",
      "cols": [
        "level",
        "dec113",
        "bud114",
        "name",
        "desc",
        "orig",
        "dep_diff",
        "dep_app",
        "gov_diff",
        "gov_app"
      ],
      "hasLevel": true,
      "reviewKey": "plan",
      "isPlan": true,
      "fundId": "plan_disaster",
      "fundCode": "disaster",
      "fundName": "農業天然災害救助基金",
      "fundShort": "天災",
      "section": "src",
      "sectionLabel": "甲、基金來源",
      "rank": 3
    },
    {
      "id": "plan_disaster_use",
      "title": "農業天然災害救助基金 116年度 主要業務計畫預算表 — 乙、基金用途",
      "sheetId": "1-2",
      "unit": "新臺幣千元",
      "cols": [
        "level",
        "dec113",
        "bud114",
        "name",
        "desc",
        "orig",
        "dep_diff",
        "dep_app",
        "gov_diff",
        "gov_app"
      ],
      "hasLevel": true,
      "reviewKey": "plan",
      "isPlan": true,
      "fundId": "plan_disaster",
      "fundCode": "disaster",
      "fundName": "農業天然災害救助基金",
      "fundShort": "天災",
      "section": "use",
      "sectionLabel": "乙、基金用途",
      "rank": 3
    },
    {
      "id": "plan_fish_src",
      "title": "漁業發展基金 116年度 主要業務計畫預算表 — 甲、基金來源",
      "sheetId": "1-2",
      "unit": "新臺幣千元",
      "cols": [
        "level",
        "dec113",
        "bud114",
        "name",
        "desc",
        "orig",
        "dep_diff",
        "dep_app",
        "gov_diff",
        "gov_app"
      ],
      "hasLevel": true,
      "reviewKey": "plan",
      "isPlan": true,
      "fundId": "plan_fish",
      "fundCode": "fish",
      "fundName": "漁業發展基金",
      "fundShort": "漁業",
      "section": "src",
      "sectionLabel": "甲、基金來源",
      "rank": 4
    },
    {
      "id": "plan_fish_use",
      "title": "漁業發展基金 116年度 主要業務計畫預算表 — 乙、基金用途",
      "sheetId": "1-2",
      "unit": "新臺幣千元",
      "cols": [
        "level",
        "dec113",
        "bud114",
        "name",
        "desc",
        "orig",
        "dep_diff",
        "dep_app",
        "gov_diff",
        "gov_app"
      ],
      "hasLevel": true,
      "reviewKey": "plan",
      "isPlan": true,
      "fundId": "plan_fish",
      "fundCode": "fish",
      "fundName": "漁業發展基金",
      "fundShort": "漁業",
      "section": "use",
      "sectionLabel": "乙、基金用途",
      "rank": 4
    },
    {
      "id": "plan_loss_src",
      "title": "農產品受進口損害救助基金 116年度 主要業務計畫預算表 — 甲、基金來源",
      "sheetId": "1-2",
      "unit": "新臺幣千元",
      "cols": [
        "level",
        "dec113",
        "bud114",
        "name",
        "desc",
        "orig",
        "dep_diff",
        "dep_app",
        "gov_diff",
        "gov_app"
      ],
      "hasLevel": true,
      "reviewKey": "plan",
      "isPlan": true,
      "fundId": "plan_loss",
      "fundCode": "loss",
      "fundName": "農產品受進口損害救助基金",
      "fundShort": "農損",
      "section": "src",
      "sectionLabel": "甲、基金來源",
      "rank": 5
    },
    {
      "id": "plan_loss_use",
      "title": "農產品受進口損害救助基金 116年度 主要業務計畫預算表 — 乙、基金用途",
      "sheetId": "1-2",
      "unit": "新臺幣千元",
      "cols": [
        "level",
        "dec113",
        "bud114",
        "name",
        "desc",
        "orig",
        "dep_diff",
        "dep_app",
        "gov_diff",
        "gov_app"
      ],
      "hasLevel": true,
      "reviewKey": "plan",
      "isPlan": true,
      "fundId": "plan_loss",
      "fundCode": "loss",
      "fundName": "農產品受進口損害救助基金",
      "fundShort": "農損",
      "section": "use",
      "sectionLabel": "乙、基金用途",
      "rank": 5
    },
    {
      "id": "plan_renewal_src",
      "title": "農村再生基金 116年度 主要業務計畫預算表 — 甲、基金來源",
      "sheetId": "1-2",
      "unit": "新臺幣千元",
      "cols": [
        "level",